{
  "$schema": "https://json-schema.org/draft/2020-12/schema",
  "$id": "https://aiinformationprocessor.local/contracts/llm_score.schema.json",
  "title": "LlmScore",
  "description": "Structured enrichment fragment emitted by 02_enrich_with_llm before downstream policy and write steps.",
  "type": "object",
  "additionalProperties": false,
  "required": [
    "score",
    "score_scale",
    "category",
    "tags",
    "summary",
    "reason",
    "ai_score",
    "score_dimensions",
    "ai_meta",
    "enriched_at",
    "status"
  ],
  "properties": {
    "score": {
      "type": "number",
      "minimum": 0,
      "maximum": 1,
      "description": "Compatibility normalized score. Must equal ai_score.keep_score / score_scale."
    },
    "score_scale": {
      "type": "integer",
      "const": 100,
      "description": "Canonical score scale for ai_score.keep_score. Must remain 100."
    },
    "category": {
      "type": "string",
      "minLength": 1
    },
    "tags": {
      "type": "array",
      "items": {
        "type": "string",
        "minLength": 1
      },
      "uniqueItems": true
    },
    "summary": {
      "type": "string",
      "minLength": 1
    },
    "reason": {
      "type": "string",
      "minLength": 1
    },
    "ai_score": {
      "type": "object",
      "required": [
        "keep_score",
        "notify_score",
        "reference_score",
        "action_score",
        "confidence",
        "decision_hint"
      ],
      "properties": {
        "keep_score": {
          "type": "integer",
          "minimum": 0,
          "maximum": 100,
          "description": "Canonical keep score on a 0-100 scale. Top-level score must equal keep_score / score_scale."
        },
        "notify_score": {
          "type": "integer",
          "minimum": 0,
          "maximum": 100
        },
        "reference_score": {
          "type": "integer",
          "minimum": 0,
          "maximum": 100
        },
        "action_score": {
          "type": "integer",
          "minimum": 0,
          "maximum": 100
        },
        "confidence": {
          "type": "number",
          "minimum": 0,
          "maximum": 1
        },
        "decision_hint": {
          "type": "string",
          "enum": [
            "keep_full",
            "keep_reference",
            "review",
            "skip"
          ]
        }
      },
      "additionalProperties": false
    },
    "score_dimensions": {
      "type": "object",
      "required": [
        "personal_relevance",
        "information_density",
        "novelty",
        "actionability",
        "long_term_value",
        "source_quality",
        "penalty"
      ],
      "properties": {
        "personal_relevance": {
          "type": "integer",
          "minimum": 0,
          "maximum": 25
        },
        "information_density": {
          "type": "integer",
          "minimum": 0,
          "maximum": 20
        },
        "novelty": {
          "type": "integer",
          "minimum": 0,
          "maximum": 20
        },
        "actionability": {
          "type": "integer",
          "minimum": 0,
          "maximum": 15
        },
        "long_term_value": {
          "type": "integer",
          "minimum": 0,
          "maximum": 15
        },
        "source_quality": {
          "type": "integer",
          "minimum": 0,
          "maximum": 5
        },
        "penalty": {
          "type": "integer",
          "minimum": -20,
          "maximum": 0
        }
      },
      "additionalProperties": false
    },
    "ai_meta": {
      "type": "object",
      "required": [
        "model_profile",
        "provider",
        "model",
        "prompt_version",
        "rubric_version",
        "input_chars",
        "scored_at"
      ],
      "properties": {
        "model_profile": {
          "type": "string",
          "minLength": 1
        },
        "provider": {
          "type": "string",
          "minLength": 1
        },
        "model": {
          "type": "string",
          "minLength": 1
        },
        "prompt_version": {
          "type": "string",
          "minLength": 1
        },
        "rubric_version": {
          "type": "string",
          "minLength": 1
        },
        "input_chars": {
          "type": "integer",
          "minimum": 1
        },
        "scored_at": {
          "type": "string",
          "format": "date-time"
        }
      },
      "additionalProperties": false
    },
    "enriched_at": {
      "type": "string",
      "format": "date-time"
    },
    "status": {
      "type": "string",
      "enum": [
        "enriched"
      ]
    }
  }
}
