{
  "score": 0.82,
  "score_scale": 100,
  "category": "AI Infra",
  "tags": [
    "inbox",
    "ai-information-processor",
    "structured-score",
    "rss"
  ],
  "summary": "Structured scoring keeps the mainline contract compatible while making enrichment outputs auditable.",
  "reason": "The content is directly relevant to the repo's architecture and introduces a practical scoring migration path.",
  "ai_score": {
    "keep_score": 82,
    "notify_score": 64,
    "reference_score": 88,
    "action_score": 45,
    "confidence": 0.76,
    "decision_hint": "keep_reference"
  },
  "score_dimensions": {
    "personal_relevance": 22,
    "information_density": 18,
    "novelty": 16,
    "actionability": 10,
    "long_term_value": 15,
    "source_quality": 4,
    "penalty": -3
  },
  "ai_meta": {
    "model_profile": "scoring_default",
    "provider": "deepseek",
    "model": "deepseek-chat",
    "prompt_version": "scoring_v1",
    "rubric_version": "personal_info_processor_v1",
    "input_chars": 129,
    "scored_at": "2026-04-20T08:35:30Z"
  },
  "enriched_at": "2026-04-20T08:35:30Z",
  "status": "enriched"
}
